latent_idx,hook_action,steering_coefficient,sae_id,sae_release,description
11766,clamp,-77.83291791176666,layer_7/width_16k/canonical,gemma-scope-2b-pt-res-canonical,mentions of the coronavirus pandemic and related medical terms
9723,clamp,-42.44454985387821,layer_7/width_16k/canonical,gemma-scope-2b-pt-res-canonical,references to viral RNA and its properties
4788,clamp,-41.737502276205085,layer_7/width_16k/canonical,gemma-scope-2b-pt-res-canonical,terms related to viral infections and their impact on health
1709,clamp,-33.45854050218762,layer_7/width_16k/canonical,gemma-scope-2b-pt-res-canonical,terms associated with epidemiological factors in disease transmission
9186,clamp,-26.777173075267676,layer_7/width_16k/canonical,gemma-scope-2b-pt-res-canonical,terms related to respiratory health conditions and treatments
